{
  "schemaVersion": 2,
  "planKind": "vmNetwork",
  "planRole": "change",
  "planId": "31111111-1111-4111-8111-111111111111",
  "pairedPlanId": "32222222-2222-4222-8222-222222222222",
  "createdAt": "2026-07-21T08:00:00Z",
  "expiresAt": "2026-07-21T08:15:00Z",
  "hostFingerprint": "aaaaaaaaaaaaaaaaaaaaaaaaaaaaaaaaaaaaaaaaaaaaaaaaaaaaaaaaaaaaaaaa",
  "vmId": "vm-123",
  "vmName": "clean-room-01",
  "ownershipId": "22222222-2222-4222-8222-222222222222",
  "ownershipRecordSha256": "bbbbbbbbbbbbbbbbbbbbbbbbbbbbbbbbbbbbbbbbbbbbbbbbbbbbbbbbbbbbbbbb",
  "vmFingerprint": "cccccccccccccccccccccccccccccccccccccccccccccccccccccccccccccccc",
  "adapter": {
    "id": "nic-1",
    "name": "Network Adapter",
    "macAddress": "00155D010203",
    "fingerprint": "dddddddddddddddddddddddddddddddddddddddddddddddddddddddddddddddd"
  },
  "baselineAttachment": {
    "mode": "connected",
    "switchId": "switch-1",
    "switchName": "Default Switch",
    "switchType": "Internal"
  },
  "currentAttachment": {
    "mode": "connected",
    "switchId": "switch-1",
    "switchName": "Default Switch",
    "switchType": "Internal"
  },
  "target": "disconnected",
  "targetAttachment": { "mode": "disconnected" },
  "preconditions": {
    "ownershipVerified": true,
    "primaryAdapterVerified": true,
    "baselineSwitchPresent": true,
    "noAdapterConfigurationDrift": true
  }
}
